{
  "$schema": "https://json-schema.org/draft/2020-12/schema",
  "$id": "tab-names.schema.json",
  "title": "Tab name pool contract",
  "description": "The pool the worker and the browser dialogs both name new tabs from. The name pattern is the one plan_mode.go's auto-title regex accepts, so a name that fails it here would silently disable plan-mode auto-rename instead of failing the build. The 8-character cap keeps a tab title short. Rules the schema CANNOT express -- friendly form only, predictable pronunciation, distinct at a glance, no identity marker -- live in the contract's _rules field and are applied by a reviewer.",
  "type": "object",
  "additionalProperties": false,
  "required": ["_readme", "_rules", "titlePrefixes", "names"],
  "properties": {
    "_readme": { "type": "string", "minLength": 1 },
    "_rules": { "type": "string", "minLength": 1 },
    "titlePrefixes": {
      "type": "object",
      "additionalProperties": false,
      "required": ["agent", "terminal"],
      "properties": {
        "agent": { "$ref": "#/$defs/titlePrefix" },
        "terminal": { "$ref": "#/$defs/titlePrefix" }
      }
    },
    "names": {
      "type": "array",
      "minItems": 32,
      "uniqueItems": true,
      "items": {
        "type": "string",
        "pattern": "^[A-Z][A-Za-z]+$",
        "minLength": 2,
        "maxLength": 8
      }
    }
  },
  "$defs": {
    "titlePrefix": {
      "type": "string",
      "pattern": "^[A-Z][A-Za-z]+$",
      "minLength": 2,
      "maxLength": 16
    }
  }
}
