{
  "_readme": "Single source of truth for the pool the platform draws tab titles from. The worker picks from it whenever a caller opens an agent or a terminal without a title (the quick-open buttons, and a CLI `tab open` with no --title); the New Agent, New Terminal and Change-branch dialogs pick from the same table to pre-fill their Title field and then SEND it. Both sides generate from this file -- Go reads contracts.TabNames, the browser reads TAB_NAMES -- so the two can never drift. A title is `<prefix> <name>`, joined with one space: `Agent Gabe`, `Terminal Tim`. The ^[A-Z][A-Za-z]+$ shape is READABILITY only: nothing reads a title back to decide what it means. Plan-mode auto-rename used to match a title against that pattern to decide whether it may overwrite it, which read a typed `Agent Bob` as a pooled name; the agents row records the answer instead (title_auto_generated), so the pool is free of that tie.",
  "_rules": "Six rules decide what goes in. 1 SHAPE: ^[A-Z][A-Za-z]+$, 2 to 8 characters, no hyphen or apostrophe or accent. 2 FRIENDLY FORM ONLY: when everyday usage shortens a name, the pool carries the short form alone -- William gives Bill, Robert gives Bob, Theodore gives Theo, Isabella gives Bella, Harriet gives Hattie. A name usage does not shorten (Noah, Mia, Isla, Luna, Mateo) stays whole. Bill and Will both stay: they differ at the first letter, the position a reader scans. 3 ONE SPELLING PER NAME: Sophie not Sofia, Luca not Luka, Zoe not Zoey, Jaxon not Jaxson. 4 PREDICTABLE PRONUNCIATION: drop a name whose English pronunciation the spelling does not give -- Niamh, Esme, Cassius, Xavier, Gael, Jose, Ayla, Thea, Lucia, Ottilie. 5 DISTINCT AT A GLANCE: drop one of any pair a reader must look twice at -- Lyla beats Lila and Lilah, Mila beats Myla, Amara beats Amira, Audrey beats Aubrey. 6 NO IDENTITY MARKER: a name whose dominant reading is a specific religious figure or a religious or national symbol does not belong on a randomly-assigned scratch terminal, so Muhammad, Zion, Krishna and Jesus are out. That rule is about the FIGURE, not the language: Mateo, Camila and Amir are ordinary given names and stay, and a religious origin that naturalized into everyday English (Noah, Adam, Sarah, John, Micah, Genesis) is not a marker. Santiago and Genesis are kept deliberately, though one is `Saint James` and the other a book of the Bible, because neither reads that way in use. Rules 1 and 3 are mechanical and the schema plus checkTabNames enforce them. Rules 2, 4, 5 and 6 are judgment, and NO check can hold them -- a reviewer applies them at edit time.",
  "titlePrefixes": {
    "agent": "Agent",
    "terminal": "Terminal"
  },
  "names": [
    "Aaron", "Ace", "Ada", "Adam", "Addie", "Adrian", "Aiden", "Alba",
    "Alex", "Alfie", "Alice", "Alma", "Amara", "Amber", "Amir", "Anna",
    "Annie", "Archie", "Aria", "Ariana", "Arlo", "Arthur", "Asher",
    "Athena", "Atlas", "Audrey", "Aurora", "Austin", "Autumn", "Ava",
    "Avery", "Axel", "Bart", "Bea", "Beau", "Becca", "Beckett", "Bella",
    "Ben", "Bennett", "Bill", "Birdie", "Bob", "Bonnie", "Brent", "Briar",
    "Brielle", "Brody", "Brooklyn", "Brooks", "Caleb", "Cam", "Camila",
    "Carrie", "Carter", "Charlie", "Chloe", "Chris", "Claire", "Clara",
    "Clem", "Cleo", "Clover", "Cole", "Colt", "Connor", "Cooper", "Cora",
    "Curtis", "Daisy", "Dan", "Daphne", "Darcie", "Dave", "Dean", "Declan",
    "Drew", "Dylan", "Easton", "Eddie", "Eden", "Edie", "Effie", "Elena",
    "Eli", "Eliza", "Ella", "Ellie", "Elliot", "Eloise", "Elsie", "Ember",
    "Emery", "Emily", "Emma", "Enzo", "Erin", "Ethan", "Etta", "Eva",
    "Everett", "Everly", "Evie", "Ezra", "Felix", "Fern", "Finn",
    "Florence", "Frankie", "Freddie", "Freya", "Gabby", "Gabe", "Genesis",
    "George", "Gianna", "Gigi", "Glenn", "Grace", "Gray", "Greg", "Greta",
    "Gus", "Hannah", "Harper", "Harry", "Hattie", "Hazel", "Heath",
    "Henry", "Holly", "Hope", "Hudson", "Hugo", "Hunter", "Ian", "Idris",
    "Imogen", "Iris", "Isaac", "Isla", "Ivy", "Jack", "Jade", "Jake",
    "Jamie", "Jasper", "Jaxon", "Jayden", "Jenna", "Jenson", "Jerry",
    "Jess", "Jim", "Joe", "John", "Josh", "Josiah", "Josie", "Jude",
    "Jules", "June", "Kai", "Kane", "Katie", "Kayla", "Kennedy", "Kinsley",
    "Kit", "Knox", "Lainey", "Landon", "Lara", "Lark", "Layla", "Leah",
    "Lena", "Leo", "Levi", "Liam", "Lily", "Lincoln", "Liz", "Logan",
    "Lola", "Lottie", "Louie", "Luca", "Lucy", "Luke", "Luna", "Lydia",
    "Lyla", "Mabel", "Maddie", "Mae", "Maeve", "Maisie", "Margot", "Maria",
    "Marnie", "Marty", "Mary", "Mason", "Mateo", "Matt", "Maverick", "Max",
    "Maya", "Megan", "Mel", "Mia", "Micah", "Mike", "Mila", "Miles",
    "Millie", "Milo", "Mimi", "Mitch", "Mona", "Nancy", "Naomi", "Natalie",
    "Nate", "Nell", "Nick", "Nina", "Noah", "Nolan", "Nora", "Nova",
    "Oakley", "Olivia", "Ollie", "Opal", "Ophelia", "Orla", "Oscar",
    "Otis", "Owen", "Paisley", "Parker", "Patrick", "Pearl", "Penny",
    "Phil", "Phoebe", "Polly", "Poppy", "Quinn", "Raelynn", "Ralph",
    "Reagan", "Reggie", "Remy", "Reuben", "Rex", "Riley", "River", "Rob",
    "Robyn", "Roman", "Ronan", "Ronnie", "Rory", "Rosie", "Rowan", "Roxy",
    "Roy", "Ruby", "Rupert", "Ryan", "Sadie", "Sage", "Sam", "Santi",
    "Sarah", "Sasha", "Saskia", "Savannah", "Scarlett", "Seb", "Serenity",
    "Sienna", "Silas", "Skye", "Sloane", "Sonny", "Sophie", "Stan",
    "Stella", "Sully", "Tabby", "Teddy", "Tess", "Theo", "Tilda", "Tilly",
    "Tim", "Tina", "Toby", "Tom", "Tony", "Trixie", "Tyler", "Vic",
    "Vince", "Violet", "Vivi", "Wade", "Walker", "Waylon", "Wendy", "Wes",
    "Will", "Willow", "Wren", "Wyatt", "Zac", "Zara", "Zeke", "Zelda",
    "Zoe"
  ]
}
